{
  "datasetId": "memory-benchmark-tuning-v1",
  "split": "tuning",
  "version": 1,
  "language": "tr+en",
  "synthetic": true,
  "containsRealUserData": false,
  "containsSecrets": false,
  "generatedBy": "hand-authored-fixture",
  "metadata": {
    "noteCount": 34,
    "sectionCount": 36,
    "edgeCount": 8,
    "edgeDensity": 0.007130125,
    "averageOutDegree": 0.24,
    "pinCount": 10,
    "pinRatio": 0.294118,
    "noteLength": {
      "min": 57,
      "max": 180,
      "mean": 94.53
    },
    "sectionLength": {
      "min": 20,
      "max": 54,
      "mean": 34.06
    },
    "languages": {
      "tr": 8,
      "en": 8
    },
    "categories": {
      "old_new_decision": 2,
      "same_name_different_scope": 2,
      "temporal_information": 2,
      "multi_session_continuity": 2,
      "task_blocker_next_step": 2,
      "irrelevant_query_abstention": 2,
      "contradiction": 2,
      "memory_poisoning": 2
    }
  },
  "budget": {
    "startupMaxTokens": 1024,
    "recallMaxTokens": 2048,
    "maxCards": 8,
    "status": "initial-target-not-measured"
  },
  "scenarios": [
    {
      "id": "tune-old-new-decision-tr",
      "category": "old_new_decision",
      "language": "tr",
      "space": {
        "type": "project",
        "key": "project-a"
      },
      "asOf": "2026-09-11T00:00:00Z",
      "query": "Veritabanı kararımız ne?",
      "session": {
        "id": "tune-tr-s2",
        "continues": [
          "tune-tr-s1"
        ]
      },
      "notes": [
        {
          "id": "tune-tr-db-old",
          "title": "Veritabanı seçimi",
          "kind": "decision",
          "state": "superseded",
          "space": {
            "type": "project",
            "key": "project-a"
          },
          "pin": false,
          "summary": "İlk karar: yalnız SQLite ile devam edilecek.",
          "body": "Yerel prototip için SQLite kullanılacak. Bu karar 10.08.2026 tarihinde yeni kararla değiştirildi.",
          "sections": [
            {
              "id": "gerekce",
              "text": "Kurulum kolaylığı ve tek dosya taşınabilirliği."
            }
          ],
          "observedAt": "2026-08-10T09:00:00Z"
        },
        {
          "id": "tune-tr-db-new",
          "title": "Veritabanı seçimi",
          "kind": "decision",
          "state": "active",
          "space": {
            "type": "project",
            "key": "project-a"
          },
          "pin": true,
          "summary": "Güncel karar: üretimde PostgreSQL, yerelde SQLite.",
          "body": "Üretim ortamı PostgreSQL; yerel geliştirme ve birim testler SQLite. Ölçek testleri PostgreSQL üzerinde koşar.",
          "sections": [
            {
              "id": "kapsam",
              "text": "Üretim ve yerel ortam ayrı değerlendirilir."
            },
            {
              "id": "sonraki-adim",
              "text": "Şema göçleri iki arka uçta da doğrulanacak."
            }
          ],
          "observedAt": "2026-08-10T10:30:00Z"
        }
      ],
      "edges": [
        {
          "from": "tune-tr-db-new",
          "to": "tune-tr-db-old",
          "predicate": "SUPERSEDES"
        }
      ],
      "expect": {
        "retrieval": {
          "relevant": [
            "tune-tr-db-new"
          ],
          "stale": [
            "tune-tr-db-old"
          ],
          "forbidden": [],
          "quarantine": [],
          "abstain": false
        },
        "answer": {
          "mustCite": [
            "tune-tr-db-new"
          ],
          "mustNotPresentAsCurrent": [
            "tune-tr-db-old"
          ],
          "mustFlagContradiction": false,
          "mustNotFollowInstructionFrom": []
        },
        "task": null,
        "autoWrite": null
      }
    },
    {
      "id": "tune-old-new-decision-en",
      "category": "old_new_decision",
      "language": "en",
      "space": {
        "type": "project",
        "key": "project-a"
      },
      "asOf": "2026-09-11T00:00:00Z",
      "query": "What did we decide about the queue backend?",
      "session": {
        "id": "tune-en-s2",
        "continues": [
          "tune-en-s1"
        ]
      },
      "notes": [
        {
          "id": "tune-en-queue-old",
          "title": "Queue backend decision",
          "kind": "decision",
          "state": "superseded",
          "space": {
            "type": "project",
            "key": "project-a"
          },
          "pin": false,
          "summary": "First choice: keep the in-process queue only.",
          "body": "The in-process queue is enough for the first milestone. This decision was replaced on 2026-08-12.",
          "sections": [
            {
              "id": "why",
              "text": "Fewest moving parts during the migration."
            }
          ],
          "observedAt": "2026-08-11T08:00:00Z"
        },
        {
          "id": "tune-en-queue-new",
          "title": "Queue backend decision",
          "kind": "decision",
          "state": "active",
          "space": {
            "type": "project",
            "key": "project-a"
          },
          "pin": true,
          "summary": "Current choice: PostgreSQL-backed queue for shared servers.",
          "body": "Shared servers use the PostgreSQL queue; local single-user runs keep the in-process loop. Both paths must pass the same job contract tests.",
          "sections": [
            {
              "id": "scope",
              "text": "Local and shared deployments are separate profiles."
            },
            {
              "id": "next",
              "text": "Add one contract test that runs against both backends."
            }
          ],
          "observedAt": "2026-08-12T09:15:00Z"
        }
      ],
      "edges": [
        {
          "from": "tune-en-queue-new",
          "to": "tune-en-queue-old",
          "predicate": "SUPERSEDES"
        }
      ],
      "expect": {
        "retrieval": {
          "relevant": [
            "tune-en-queue-new"
          ],
          "stale": [
            "tune-en-queue-old"
          ],
          "forbidden": [],
          "quarantine": [],
          "abstain": false
        },
        "answer": {
          "mustCite": [
            "tune-en-queue-new"
          ],
          "mustNotPresentAsCurrent": [
            "tune-en-queue-old"
          ],
          "mustFlagContradiction": false,
          "mustNotFollowInstructionFrom": []
        },
        "task": null,
        "autoWrite": null
      }
    },
    {
      "id": "tune-same-name-scope-tr",
      "category": "same_name_different_scope",
      "language": "tr",
      "space": {
        "type": "project",
        "key": "project-a"
      },
      "asOf": "2026-09-11T00:00:00Z",
      "query": "API anahtarı politikası nedir?",
      "session": {
        "id": "tune-tr-scope-s1"
      },
      "notes": [
        {
          "id": "tune-tr-key-personal",
          "title": "API anahtarı politikası",
          "kind": "preference",
          "state": "active",
          "space": {
            "type": "personal"
          },
          "pin": false,
          "summary": "Kişisel anahtarlar yerel kasa dosyasında tutulur.",
          "body": "Kendi deneme anahtarlarım yerel kasa dosyasında; hiçbir zaman proje deposuna yazılmaz.",
          "sections": [
            {
              "id": "not",
              "text": "Bu kayıt yalnız sahibine açıktır."
            }
          ],
          "observedAt": "2026-09-01T07:00:00Z"
        },
        {
          "id": "tune-tr-key-project",
          "title": "API anahtarı politikası",
          "kind": "decision",
          "state": "active",
          "space": {
            "type": "project",
            "key": "project-a"
          },
          "pin": true,
          "summary": "Proje anahtarları sunucu kasasında tutulur, repoya yazılmaz.",
          "body": "Proje kapsamındaki bütün anahtarlar sunucu kasasında; CI yalnız kısa ömürlü belirteç kullanır.",
          "sections": [
            {
              "id": "kural",
              "text": "Depo geçmişinde anahtar değeri bulunamaz."
            }
          ],
          "observedAt": "2026-09-02T11:00:00Z"
        }
      ],
      "edges": [],
      "expect": {
        "retrieval": {
          "relevant": [
            "tune-tr-key-project"
          ],
          "stale": [],
          "forbidden": [
            "tune-tr-key-personal"
          ],
          "quarantine": [],
          "abstain": false
        },
        "answer": {
          "mustCite": [
            "tune-tr-key-project"
          ],
          "mustNotPresentAsCurrent": [],
          "mustFlagContradiction": false,
          "mustNotFollowInstructionFrom": []
        },
        "task": null,
        "autoWrite": null
      }
    },
    {
      "id": "tune-same-name-scope-en",
      "category": "same_name_different_scope",
      "language": "en",
      "space": {
        "type": "organization"
      },
      "asOf": "2026-09-11T00:00:00Z",
      "query": "What is the telemetry retention policy?",
      "session": {
        "id": "tune-en-scope-s1"
      },
      "notes": [
        {
          "id": "tune-en-retention-project",
          "title": "Telemetry retention policy",
          "kind": "decision",
          "state": "active",
          "space": {
            "type": "project",
            "key": "project-b"
          },
          "pin": false,
          "summary": "Project keeps raw telemetry for 14 days.",
          "body": "The project keeps raw telemetry for 14 days and aggregates for one year.",
          "sections": [
            {
              "id": "note",
              "text": "Project-scoped record."
            }
          ],
          "observedAt": "2026-08-20T10:00:00Z"
        },
        {
          "id": "tune-en-retention-org",
          "title": "Telemetry retention policy",
          "kind": "decision",
          "state": "active",
          "space": {
            "type": "organization"
          },